{
  "$schema": "reusable-module-catalog.schema.json",
  "catalog_id": "DBA-REUSABLE-MODULE-CATALOG-0.1",
  "catalog_version": "0.1.0",
  "status": "SOURCE_BOUND_CATALOG_NO_RUNTIME_AUTHORITY",
  "primary_repository": "DBA",
  "observed_at": "2026-09-23",
  "reuse_levels": {
    "DIRECT_REUSE": "The declared non-authoritative artifact or command can be reused within its exact verified scope.",
    "ADAPTATION_REQUIRED": "The capability exists, but a new project needs an owner-approved adapter or contract mapping.",
    "SPECIFICATION_ONLY": "Only a normative or planning contract exists; no callable implementation is claimed.",
    "VERIFICATION_REQUIRED": "A prior audit identified the owner, but the canonical source must be re-read before use."
  },
  "capability_discovery_boundary": {
    "capability_discovery": "Finds and compares reusable technical capabilities, source identities, versions, overlap and adopt-before-build options.",
    "project_evidence_gap_completion": "Collects missing project facts such as photographs, dimensions, building identity and conflicting source material; it is a domain evidence intake task, not a GitHub capability search."
  },
  "consumer_links": [
    {
      "consumer_id": "3d-building-disassembly-pipeline",
      "request_reference": "codex-thread:01a0c8de-3616-71e3-90ce-93d66f246f80",
      "need_class": "PROJECT_EVIDENCE_GAP_COMPLETION_AND_CAPABILITY_REUSE_ASSESSMENT",
      "required_evidence": [
        "building photographs with source and viewpoint",
        "dimensions and measurement provenance",
        "building identity and location disambiguation",
        "conflict-preserving source comparison"
      ],
      "recommended_module_ids": [
        "DBA-MOD-GOVERNANCE-INTELLIGENCE-INTAKE-001",
        "DBA-MOD-EXTERNAL-CAPABILITY-DISCOVERY-PROFILE-002",
        "DBA-MOD-DISCOVERY-ABSORPTION-FIXTURE-001"
      ],
      "remaining_gap": "No verified building-domain evidence intake adapter is registered. GitHub code discovery alone cannot close the photographic, dimensional, identity or source-conflict gaps.",
      "status": "REUSE_ASSESSMENT_COMPLETE_IMPLEMENTATION_NOT_REQUESTED"
    }
  ],
  "modules": [
    {
      "module_id": "DBA-MOD-TITMAC-SCOUT-STATUS-BRIDGE-001",
      "title": "titmac-scout read-only cockpit status bridge",
      "responsibility": "Read a source-pinned titmac-scout status contract and produce a fail-closed DBA cockpit projection without writing to the owner repository.",
      "applicable_scenarios": [
        "observe titmac-scout source, CI and pull request status",
        "reuse its source identity and freshness semantics when designing another read-only project bridge"
      ],
      "owner": "joy7758/titmac-scout for implementation and status; DBA for read-only projection",
      "canonical_repository": "joy7758/titmac-scout",
      "actual_entries": [
        {
          "entry_type": "SOURCE_REGISTRY",
          "reference": "cockpit/source-registry.json",
          "status": "ACTIVE_READ_ONLY"
        },
        {
          "entry_type": "ADAPTER",
          "reference": "cockpit/read_only_status_adapter.py",
          "status": "CALLABLE_FOR_REGISTERED_SOURCE"
        },
        {
          "entry_type": "PROJECTION",
          "reference": "cockpit/projections/titmac-scout.json",
          "status": "STALE_POINT_IN_TIME_PROJECTION"
        },
        {
          "entry_type": "LOCAL_HISTORICAL_COPY",
          "reference": "/Users/zhangbin/GitHub/tiamas-scout",
          "status": "HEAD_0b2b4e5_NO_REMOTE_NOT_CANONICAL_CURRENT_PROOF"
        }
      ],
      "input_contract": [
        "project_id fixed to titmac-scout by the current source registry schema",
        "canonical governance/project-status.json and schema",
        "optional local repository or read-only GitHub observation"
      ],
      "output_contract": [
        "source-bound cockpit projection",
        "freshness, CI, pull request and authority-boundary fields",
        "explicit UNKNOWN or fail-closed state on unavailable source"
      ],
      "dependencies": [
        "Python 3",
        "local Git or read-only GitHub access when dynamic refresh is requested"
      ],
      "invocation": "python3 cockpit/read_only_status_adapter.py --project-id titmac-scout --output cockpit/projections/titmac-scout.json",
      "permissions_and_side_effects": [
        "READ_ONLY against owner source",
        "writes only the requested local DBA projection",
        "does not repair, merge, deploy or activate titmac-scout"
      ],
      "identity": {
        "version": "source-registry-0.1",
        "source_revision": "e4adbbbbb149871f108fcf384369182d8c5765f4",
        "revision_status": "PINNED_BY_COCKPIT_SOURCE_REGISTRY"
      },
      "verification": {
        "status": "PASS_AT_PINNED_REVISION_DYNAMIC_OBSERVATION_STALE",
        "observed_at": "2026-08-08T16:58:10.468511Z",
        "evidence_references": [
          "cockpit/projections/titmac-scout.json",
          "cockpit/tests/test_titmac_scout_bridge.py",
          "architecture/ADR-040-titmac-scout-canonical-identity-and-read-only-progress-bridge.md"
        ]
      },
      "limitations": [
        "tiamas-scout is a conversation alias only",
        "the local tiamas-scout copy has no remote and cannot prove the canonical e4adbbb source is current",
        "the current adapter and schema are not a generic multi-project discovery service",
        "the stored dynamic observation is stale and must be refreshed before a current-state claim",
        "Historical local copy /Users/zhangbin/GitHub/tiamas-scout has LICENSE=UNKNOWN; treat code reuse as DESIGN_REFERENCE_OR_LICENSE_VERIFICATION_REQUIRED, not as permission to copy."
      ],
      "reuse_level": "ADAPTATION_REQUIRED",
      "reuse_reason": "Directly reusable for titmac-scout; other projects need a separately owned source-registry and schema extension rather than copying its identity."
    },
    {
      "module_id": "DBA-MOD-TITMAC-SCOUT-GITHUB-OPPORTUNITY-DISCOVERY-001",
      "title": "Historical titmac-scout GitHub opportunity discovery implementation",
      "responsibility": "Discover GitHub Issue candidates from fixed queries and produce normalized, deduplicated opportunity records and reports; this is distinct from the DBA read-only Scout status bridge.",
      "applicable_scenarios": [
        "study a bounded GitHub Issue capability-discovery pipeline",
        "adapt query budgeting, retry, normalization, hashing, coverage reporting and failure reporting after canonical source and license verification"
      ],
      "owner": "joy7758/titmac-scout is the declared canonical owner; canonical checkout and current owner state were not located in this review",
      "canonical_repository": "joy7758/titmac-scout",
      "actual_entries": [
        {
          "entry_type": "HISTORICAL_DISCOVERY_CLI",
          "reference": "/Users/zhangbin/GitHub/tiamas-scout/src/discovery/cli.rb",
          "status": "LOCAL_HISTORICAL_COPY_HEAD_0b2b4e5_NO_REMOTE"
        },
        {
          "entry_type": "CANONICAL_CHECKOUT",
          "reference": "joy7758/titmac-scout",
          "status": "NOT_LOCATED_NOT_CURRENTLY_VERIFIED"
        }
      ],
      "input_contract": [
        "YAML configuration with fixed GitHub Issue search queries",
        "GitHub API read access when executed",
        "query budget and retry configuration"
      ],
      "output_contract": [
        "normalized GitHub Issue candidate records",
        "deduplicated opportunity list",
        "coverage, missing-source and failure report",
        "daily report and status index"
      ],
      "dependencies": [
        "Ruby runtime and project dependencies from the historical copy",
        "GitHub API network access and credentials when execution is separately authorized"
      ],
      "invocation": "HISTORICAL_REFERENCE_ONLY: ruby /Users/zhangbin/GitHub/tiamas-scout/src/discovery/cli.rb <configuration>; do not execute until canonical source, license, credentials and current contract are verified",
      "permissions_and_side_effects": [
        "static review only in this catalog task",
        "network and GitHub credential use were not authorized or executed",
        "historical report writing may overwrite a same-day fixed filename",
        "does not collect building photos, dimensions, building identity or resolve domain-source conflicts"
      ],
      "identity": {
        "version": "historical-local-head",
        "source_revision": "0b2b4e5fab7ba4e3832786ce3d43704c782a778b",
        "revision_status": "OBSERVED_LOCAL_HISTORICAL_COPY_CANONICAL_CURRENT_REVISION_UNKNOWN"
      },
      "verification": {
        "status": "STATIC_REVIEW_ONLY_NOT_EXECUTED",
        "observed_at": "2026-09-23",
        "evidence_references": [
          "/Users/zhangbin/GitHub/tiamas-scout/src/discovery/cli.rb",
          "/Users/zhangbin/GitHub/tiamas-scout/src/discovery/deduplicator.rb",
          "/Users/zhangbin/GitHub/tiamas-scout/src/discovery/daily_report.rb",
          "/Users/zhangbin/GitHub/tiamas-scout/src/discovery/status_index.rb"
        ]
      },
      "limitations": [
        "LICENSE=UNKNOWN and code copying permission is not established",
        "canonical checkout was not located and the local copy has no remote",
        "the fixed-query GitHub Issue collector cannot consume a building evidence gap list",
        "deduplication keeps the first record for a shared URL and merges query_ids only; it has no source-conflict or version semantics",
        "daily report writing uses a same-day fixed filename and can overwrite prior same-day history",
        "status inference depends on directory contents and highest status and has no version-expiry semantics",
        "no execution, tests, network discovery or credential operation was performed in this review"
      ],
      "reuse_level": "VERIFICATION_REQUIRED",